{
  "purpose": "Implementation fit with material ServiceNow preferred gap -> APPLY.",
  "role_family": "Implementation",
  "acceptable_decisions": [
    "APPLY"
  ],
  "forbidden_decisions": [
    "PRIORITY_APPLY",
    "REJECT"
  ],
  "key_matches": {
    "REQ_IMPL_REQ": {
      "result": "STRONG",
      "require_provenance": true,
      "acceptable_results": [
        "STRONG",
        "SUPPORTED"
      ]
    },
    "REQ_IMPL_SNOW": {
      "result": "NONE"
    }
  },
  "expect_gap_substrings": [
    "ServiceNow"
  ],
  "semantic_boundaries": [
    "ServiceNow specialization unsupported"
  ],
  "known_limitations": [
    "NONE"
  ],
  "notes": [],
  "fixture_id": "GT_IMPL_FIT"
}
