{
  "purpose": "Data Operations fit grounded in CSV intake evidence; SQL preferred gap allowed.",
  "role_family": "Data Operations",
  "acceptable_decisions": [
    "PRIORITY_APPLY",
    "APPLY",
    "EFFICIENT_APPLY"
  ],
  "forbidden_decisions": [
    "REJECT"
  ],
  "key_matches": {
    "REQ_DO_DATA": {
      "result": "STRONG",
      "require_provenance": true,
      "acceptable_results": [
        "STRONG",
        "SUPPORTED"
      ]
    },
    "REQ_DO_REQ": {
      "result": "STRONG",
      "require_provenance": true,
      "acceptable_results": [
        "STRONG",
        "SUPPORTED"
      ]
    },
    "REQ_DO_UAT": {
      "result": "SUPPORTED",
      "require_provenance": true,
      "acceptable_results": [
        "STRONG",
        "SUPPORTED"
      ]
    },
    "REQ_DO_SQL": {
      "result": "NONE",
      "acceptable_results": [
        "NONE",
        "UNKNOWN"
      ]
    }
  },
  "expect_gap_substrings": [
    "SQL"
  ],
  "semantic_boundaries": [
    "do not invent SQL evidence"
  ],
  "known_limitations": [
    "NONE"
  ],
  "notes": [],
  "fixture_id": "GT_DATAOPS_FIT"
}
