{
  "purpose": "Expose P-2: generic business process mapping fails closed to NONE; core mandatory HIGH NONE blocks positive apply.",
  "role_family": "Business Process",
  "acceptable_decisions": [
    "REJECT"
  ],
  "forbidden_decisions": [
    "PRIORITY_APPLY",
    "APPLY",
    "EFFICIENT_APPLY"
  ],
  "key_matches": {
    "REQ_P2_MAP": {
      "result": "NONE"
    },
    "REQ_P2_REQ": {
      "result": "STRONG",
      "require_provenance": true,
      "acceptable_results": [
        "STRONG",
        "SUPPORTED"
      ]
    },
    "REQ_P2_UAT": {
      "result": "SUPPORTED",
      "require_provenance": true,
      "acceptable_results": [
        "STRONG",
        "SUPPORTED"
      ]
    }
  },
  "expect_gap_substrings": [
    "process"
  ],
  "require_hard_blockers": true,
  "semantic_boundaries": [
    "P-2 process mapping remains NONE without Claim/Evidence changes"
  ],
  "known_limitations": [
    "P-2"
  ],
  "notes": [
    "Conservative REJECT is expected while P-2 remains deferred."
  ],
  "fixture_id": "GT_PROCESS_MAP_P2"
}
