{
  "purpose": "Unrelated Analyst title must not APPLY via generic stakeholder/process vocabulary.",
  "role_family": "Marketing Analytics",
  "acceptable_decisions": [
    "REJECT",
    "WATCH",
    "UNDECIDED"
  ],
  "forbidden_decisions": [
    "PRIORITY_APPLY",
    "APPLY",
    "EFFICIENT_APPLY"
  ],
  "key_matches": {
    "REQ_MKT_MEDIA": {
      "result": "NONE",
      "acceptable_results": [
        "NONE",
        "UNKNOWN"
      ]
    },
    "REQ_MKT_DASH": {
      "result": "NONE",
      "acceptable_results": [
        "NONE",
        "UNKNOWN"
      ]
    }
  },
  "semantic_boundaries": [
    "Analyst title alone is insufficient for APPLY"
  ],
  "known_limitations": [
    "NONE"
  ],
  "notes": [],
  "fixture_id": "GT_UNRELATED_ANALYST"
}
