{
  "purpose": "Strong fit with material HIGH preferred Salesforce gap -> APPLY; P-1 phrasing.",
  "role_family": "Business Systems",
  "acceptable_decisions": [
    "APPLY"
  ],
  "forbidden_decisions": [
    "PRIORITY_APPLY",
    "REJECT"
  ],
  "key_matches": {
    "REQ_P1_SF": {
      "result": "NONE"
    }
  },
  "expected_importance": {
    "REQ_P1_SF": "PREFERRED"
  },
  "expect_gap_substrings": [
    "Salesforce"
  ],
  "semantic_boundaries": [
    "material preferred gap downgrades Priority to APPLY",
    "P-1 preferred-but-not-required remains PREFERRED"
  ],
  "known_limitations": [
    "NONE"
  ],
  "notes": [],
  "fixture_id": "GT_PREF_GAP_P1"
}
