{
  "purpose": "Strong early-career Business Systems fit with one preferred unsupported tool.",
  "role_family": "Business Systems",
  "acceptable_decisions": [
    "PRIORITY_APPLY",
    "APPLY",
    "EFFICIENT_APPLY"
  ],
  "forbidden_decisions": [
    "REJECT"
  ],
  "key_matches": {
    "REQ_CORE_REQ": {
      "result": "STRONG",
      "require_provenance": true,
      "acceptable_results": [
        "STRONG",
        "SUPPORTED"
      ]
    },
    "REQ_CORE_WF": {
      "result": "STRONG",
      "require_provenance": true,
      "acceptable_results": [
        "STRONG",
        "SUPPORTED"
      ]
    },
    "REQ_CORE_DATA": {
      "result": "STRONG",
      "require_provenance": true,
      "acceptable_results": [
        "STRONG",
        "SUPPORTED"
      ]
    },
    "REQ_CORE_UAT": {
      "result": "SUPPORTED",
      "require_provenance": true,
      "acceptable_results": [
        "STRONG",
        "SUPPORTED"
      ]
    },
    "REQ_CORE_CTRL": {
      "result": "STRONG",
      "require_provenance": true,
      "acceptable_results": [
        "STRONG",
        "SUPPORTED"
      ]
    },
    "REQ_PREF_SF": {
      "result": "NONE"
    }
  },
  "expect_gap_substrings": [
    "Salesforce"
  ],
  "require_hard_blockers": false,
  "semantic_boundaries": [
    "preferred Salesforce gap must not auto-reject"
  ],
  "known_limitations": [
    "NONE"
  ],
  "notes": [
    "Positive routing expected for Business Systems family."
  ],
  "fixture_id": "GT_BSA_STRONG"
}
