{
  "purpose": "Adjacent Technical Operations with thinner coverage -> EFFICIENT_APPLY.",
  "role_family": "Technical Operations",
  "acceptable_decisions": [
    "EFFICIENT_APPLY"
  ],
  "forbidden_decisions": [
    "PRIORITY_APPLY",
    "REJECT"
  ],
  "key_matches": {
    "REQ_TO_CTRL": {
      "result": "STRONG",
      "require_provenance": true,
      "acceptable_results": [
        "STRONG",
        "SUPPORTED"
      ]
    },
    "REQ_TO_DATA": {
      "result": "STRONG",
      "require_provenance": true,
      "acceptable_results": [
        "STRONG",
        "SUPPORTED"
      ]
    }
  },
  "semantic_boundaries": [
    "adjacent family without exact title dependence"
  ],
  "known_limitations": [
    "NONE"
  ],
  "notes": [],
  "fixture_id": "GT_ADJ_TECHOPS"
}
