{
  "purpose": "Enterprise QA preferred HIGH = NONE; UAT supported; APPLY.",
  "role_family": "Business Systems",
  "acceptable_decisions": [
    "APPLY"
  ],
  "forbidden_decisions": [
    "PRIORITY_APPLY",
    "REJECT"
  ],
  "key_matches": {
    "REQ_QA_UAT": {
      "result": "SUPPORTED",
      "require_provenance": true,
      "acceptable_results": [
        "STRONG",
        "SUPPORTED"
      ]
    },
    "REQ_QA_ENT": {
      "result": "NONE"
    }
  },
  "expect_gap_substrings": [
    "Enterprise QA"
  ],
  "semantic_boundaries": [
    "UAT != enterprise QA ownership"
  ],
  "known_limitations": [
    "NONE"
  ],
  "notes": [],
  "fixture_id": "GT_QA_TRAP"
}
